{
  "schemaVersion": 1,
  "generatedAt": "2026-09-17T00:10:29Z",
  "target": {
    "baseUrl": "http://localhost:52791",
    "label": "irishealth-community-2026.2",
    "product": "irisforhealth",
    "serverVersion": "IRIS for UNIX (Ubuntu Server LTS for x86-64 Containers) 2026.2 (Build 221U) Fri Jun 26 2026 09:58:52 EDT",
    "apiVersion": 2
  },
  "probes": [
    {
      "id": 1,
      "key": "admin_api",
      "title": "SysAdmin API exists and responds, and the IRIS version",
      "classification": "confirmed_present",
      "finding": {
        "apiVersion": 2,
        "serverVersion": "IRIS for UNIX (Ubuntu Server LTS for x86-64 Containers) 2026.2 (Build 221U) Fri Jun 26 2026 09:58:52 EDT",
        "product": "irisforhealth"
      },
      "raw": null,
      "durationMs": 107
    },
    {
      "id": 2,
      "key": "auth_path",
      "title": "Authentication path that works without storing credentials",
      "classification": "confirmed_present",
      "finding": {
        "selected": "in_process"
      },
      "raw": null,
      "durationMs": 3914,
      "candidates": [
        {
          "key": "in_process",
          "classification": "confirmed_present",
          "raw": null,
          "notes": "Cookie-only request reached the official API under the signed-in user; no credential kept"
        },
        {
          "key": "jwt",
          "classification": "confirmed_present",
          "raw": null,
          "notes": "Present, but refresh requires holding a refresh token (a credential); not selected by design"
        },
        {
          "key": "loopback_proxy",
          "classification": "confirmed_absent",
          "raw": "Cookie-only official call: HTTP 401\n",
          "notes": "Official API did not accept the forwarded session"
        }
      ]
    },
    {
      "id": 3,
      "key": "resource_shapes",
      "title": "Real shape of system-resources statistics and shared-memory usage",
      "classification": "confirmed_present",
      "finding": {
        "systemResources": {
          "sampleKeys": [
            "Aseize",
            "Bseize",
            "BusySet",
            "Name",
            "Nseize",
            "Seize"
          ],
          "rows": 56,
          "matchesSpec": true
        },
        "sharedMemory": {
          "sampleKeys": [
            "AllUsed",
            "Description",
            "GSTUsed",
            "SMHAllocated",
            "SMHAvailable",
            "SMHUsed",
            "SMTUsed"
          ],
          "rows": 28,
          "matchesSpec": true
        }
      },
      "raw": null,
      "durationMs": 37
    },
    {
      "id": 4,
      "key": "async_db_metrics",
      "title": "Asynchronous database-metrics cycle",
      "classification": "confirmed_present",
      "finding": {
        "directory": "/usr/irissys/mgr/user/",
        "taskStarted": true,
        "startStatus": 202,
        "pollCount": 1,
        "latencyMs": 22,
        "resultKeys": [
          "AvailableSpace",
          "BlockSize",
          "Blocks",
          "DiskFree",
          "Encrypted",
          "EncryptionKeyID",
          "EndFree",
          "ExpansionSize",
          "Full",
          "LastExpansionTime",
          "MaxSize",
          "MirrorDBName",
          "MirrorFailoverDB",
          "MirrorSetName",
          "Mirrored",
          "Mounted",
          "ReadOnlyReason",
          "SFN",
          "Size"
        ],
        "status": "",
        "sample": {
          "Size": 11,
          "ExpansionSize": 0,
          "MaxSize": 0,
          "ReadOnlyReason": "",
          "EncryptionKeyID": "",
          "BlockSize": 8192,
          "Blocks": 1408,
          "AvailableSpace": 9.9,
          "DiskFree": "797.71GB",
          "EndFree": 9,
          "LastExpansionTime": "2026-09-17 00:10:22",
          "MirrorSetName": "",
          "MirrorDBName": "",
          "SFN": 13,
          "Mirrored": false,
          "Encrypted": false,
          "Full": false,
          "Mounted": true,
          "MirrorFailoverDB": false
        }
      },
      "raw": null,
      "durationMs": 42
    },
    {
      "id": 5,
      "key": "wallet",
      "title": "Wallet endpoints respond",
      "classification": "confirmed_present",
      "finding": {
        "collectionsStatus": 200
      },
      "raw": null,
      "durationMs": 43
    },
    {
      "id": 6,
      "key": "mgmnt_api",
      "title": "REST management/discovery API is available",
      "classification": "confirmed_present",
      "finding": {
        "serviceCount": 23
      },
      "raw": null,
      "durationMs": 33
    },
    {
      "id": 7,
      "key": "log_sources",
      "title": "messages.log, alerts and interoperability event log locations",
      "classification": "confirmed_present",
      "finding": {
        "messagesLog": {
          "path": "/usr/irissys/mgr/messages.log",
          "exists": 1,
          "sampleLine": "09/17/26-00:10:22:654 (653) 0 [Utility.Event] Starting TASKMGR"
        },
        "alerts": {
          "path": "/usr/irissys/mgr/alerts.log",
          "exists": 1
        },
        "interop": {
          "queryAvailable": 1,
          "namespacesWithProductions": [
            "HSCUSTOM",
            "HSLIB",
            "HSSYS",
            "USER"
          ]
        }
      },
      "raw": null,
      "durationMs": 1851
    },
    {
      "id": 8,
      "key": "audit_enabled",
      "title": "Whether auditing is enabled",
      "classification": "confirmed_present",
      "finding": {
        "enabled": true,
        "result": {
          "Enabled": true
        }
      },
      "raw": null,
      "durationMs": 9
    }
  ],
  "summary": {
    "counts": {
      "confirmed_present": 8,
      "confirmed_absent": 0,
      "inconclusive": 0
    },
    "exitCode": 0
  }
}
